{
  "schema_version": "1.0.0",
  "problem_id": "elliptical_LEO_to_GEO",
  "mission_id": "elliptical_LEO_to_GEO",
  "transfer_strategy": {
    "type": "two_impulse_apsidal_transfer",
    "central_body": "Earth",
    "maneuver_model": "impulsive",
    "departure_apsis": "periapsis",
    "arrival_apsis": "apoapsis",
    "plane_change_policy": {
      "type": "valid_node_low_speed",
      "allow_departure_phasing": true,
      "prefer_apsis_alignment": true,
      "fallback": "split_at_nearest_valid_node"
    },
    "merge_maneuver_angle_tolerance_deg": 2.0
  },
  "initial_state": {
    "representation": "circular_orbit",
    "altitude": {
      "value": 300.0,
      "unit": "km"
    },
    "inclination": {
      "value": 23.0,
      "unit": "deg"
    },
    "raan": {
      "value": 60.0,
      "unit": "deg"
    },
    "aop": {
      "value": 30.0,
      "unit": "deg"
    },
    "true_anomaly": {
      "value": 0.0,
      "unit": "deg"
    },
    "epoch": "2026-01-01T00:00:00Z",
    "frame": "EarthMJ2000Eq"
  },
  "target": {
    "type": "geostationary_orbit",
    "inclination": {
      "value": 0.0,
      "unit": "deg"
    },
    "raan": {
      "value": 0.0,
      "unit": "deg"
    },
    "aop": {
      "value": 0.0,
      "unit": "deg"
    },
    "eccentricity": 0.0,
    "eccentricity_max": 0.001,
    "inclination_max": {
      "value": 0.05,
      "unit": "deg"
    }
  },
  "verification": {
    "required_level": "L1",
    "run_acceptance_simulation": true
  },
  "execution": {
    "backend": "gmat",
    "targeting_fidelity": "two_body",
    "acceptance_fidelity": "operational",
    "artifact_persistence": "accepted_iterations",
    "initial_coast_s": 10800.0
  }
}
